File Path,Function Name,Line Number,Panic Condition,Safety Impact,Tracking ID,Status and Handling
kiln/src/execution.rs,f32_nearest,389,This function will panic if the provided value is not an F32 value.,LOW - Minor impact on execution,KILNQ-XXX,Todo: Add validation
kiln/src/execution.rs,f64_nearest,425,This function will panic if the provided value is not an F64 value.,LOW - Minor impact on execution,KILNQ-XXX,Todo: Add validation
kiln-sync/src/mutex.rs,new,53,This function does not panic.,LOW - No safety impact,KILNQ-XXX,N/A
kiln-foundation/src/safe_memory.rs,new,50,This function will panic if the initial integrity verification fails.,MEDIUM - Initialization failure,KILNQ-XXX,Todo: Add recovery
kiln-foundation/src/bounded.rs,push,196,This function does not panic.,LOW - No safety impact,KILNQ-XXX,Return Result instead of panic
kiln-decoder/src/module.rs,encode,214,This function will panic if it attempts to access the last element of an empty vector.,HIGH - Data corruption risk,KILNQ-XXX,Todo: Add bounds checking
kiln-runtime/src/memory.rs,buffer,229,In `no_std` environments, this method will panic if the read lock cannot be acquired.,MEDIUM - Deadlock risk,KILNQ-XXX,Todo: Add timeout
kiln-runtime/src/memory.rs,peak_memory,251,In `no_std` environments, this method will panic if the read lock cannot be acquired.,MEDIUM - Deadlock risk,KILNQ-XXX,Todo: Add timeout
kiln-runtime/src/memory.rs,access_count,273,In `no_std` environments, this method will panic if the write lock cannot be acquired.,MEDIUM - Deadlock risk,KILNQ-XXX,Todo: Add timeout
kiln-runtime/src/memory.rs,increment_access_count,294,In `no_std` environments, this method will panic if the write lock cannot be acquired.,MEDIUM - Deadlock risk,KILNQ-XXX,Todo: Add timeout
